{
  "schema_version": "1.0.0",
  "approved": true,
  "manifest_digest": "sha256:ca580ba5d9bf92ec005f9f72839fb99860a620353511ef5553a369bff858b733",
  "max_starts": 4,
  "max_retries": 0,
  "parallelism": 1,
  "run_timeout_ms": 600000,
  "total_timeout_ms": 1800000,
  "advisory_usd": 10,
  "provider_cap_usd": null,
  "acknowledges_unmetered_cost": true
}
